{
  "id": "CASE_BLOCK_AGE_BELOW",
  "description": "Candidate blocks below minimum age",
  "input": {
    "age_months": 35,
    "readiness_tags": [
      "follows_one_step_direction"
    ],
    "completed_activity_ids": [],
    "available_material_ids": [
      "MAT_LARGE_DRY_COUNTERS",
      "MAT_TRAY",
      "MAT_TWO_PITCHERS"
    ],
    "supervision_level": "NEARBY",
    "policy_flags": [],
    "candidate_activity_ids": [
      "ACT-0026"
    ]
  },
  "expected": {
    "status": "NO_VALID_ACTIVITY",
    "allowed_activity_ids": [],
    "blocked": {
      "ACT-0026": [
        "BLOCK_AGE_BELOW_MINIMUM"
      ]
    }
  },
  "coverage_tags": [
    "blocked",
    "age"
  ]
}
