{
  "id": "CASE_BLOCK_MATERIAL",
  "description": "Candidate blocks when required materials are absent",
  "input": {
    "age_months": 48,
    "readiness_tags": [
      "follows_one_step_direction"
    ],
    "completed_activity_ids": [],
    "available_material_ids": [],
    "supervision_level": "NEARBY",
    "policy_flags": [],
    "candidate_activity_ids": [
      "ACT-0026"
    ]
  },
  "expected": {
    "status": "NO_VALID_ACTIVITY",
    "allowed_activity_ids": [],
    "blocked": {
      "ACT-0026": [
        "BLOCK_MISSING_MATERIAL"
      ]
    }
  },
  "coverage_tags": [
    "blocked",
    "material"
  ]
}
